{
  "schemaVersion": 1,
  "kind": "ASSISTANT_PREPARED_BOOTSTRAP_ASSESSMENT",
  "candidateSha256": "a951b581550c0330c0404a49cce8f8fe4bfdf51181eda211c24bd69fab300159",
  "observations": [
    { "optionId": "auth0-b2b-free-oidc-scim", "factPath": "facts.ENTERPRISE_SSO", "verdict": "SOURCE_SUPPORTS_CLAIM" },
    { "optionId": "auth0-b2b-free-oidc-scim", "factPath": "facts.GROUP_SYNC", "verdict": "SOURCE_SUPPORTS_CLAIM" },
    { "optionId": "auth0-b2b-free-oidc-scim", "factPath": "facts.OIDC", "verdict": "SOURCE_SUPPORTS_CLAIM" },
    { "optionId": "auth0-b2b-free-oidc-scim", "factPath": "facts.SCIM", "verdict": "SOURCE_SUPPORTS_CLAIM" },
    { "optionId": "entra-external-id-basic-standard-native", "factPath": "facts.GROUP_SYNC", "verdict": "SOURCE_SUPPORTS_CLAIM" },
    { "optionId": "entra-external-id-basic-standard-native", "factPath": "facts.OIDC", "verdict": "SOURCE_SUPPORTS_CLAIM" },
    { "optionId": "entra-external-id-basic-standard-native", "factPath": "facts.SAML", "verdict": "SOURCE_SUPPORTS_CLAIM" },
    { "optionId": "entra-external-id-basic-standard-native", "factPath": "facts.SCIM", "verdict": "SOURCE_SUPPORTS_CLAIM" },
    { "optionId": "entra-external-id-basic-standard-native", "factPath": "residency.AUDIT_LOGS", "verdict": "SOURCE_SUPPORTS_CLAIM" },
    { "optionId": "entra-external-id-basic-standard-native", "factPath": "residency.BACKUPS", "verdict": "SOURCE_SUPPORTS_CLAIM" },
    { "optionId": "entra-external-id-basic-standard-native", "factPath": "residency.CREDENTIALS", "verdict": "SOURCE_SUPPORTS_CLAIM" },
    { "optionId": "entra-external-id-basic-standard-native", "factPath": "residency.USER_PROFILES", "verdict": "SOURCE_SUPPORTS_CLAIM" },
    { "optionId": "entra-external-id-m2m-addon-machine-clients", "factPath": "compatibility.clients.MACHINE_TO_MACHINE", "verdict": "SOURCE_SUPPORTS_CLAIM" },
    { "optionId": "entra-external-id-m2m-addon-machine-clients", "factPath": "facts.OAUTH2_APIS", "verdict": "SOURCE_SUPPORTS_CLAIM" },
    { "optionId": "keycloak-26.8.0-native-self-hosted", "factPath": "compatibility.applications.B2B_SAAS", "verdict": "SOURCE_SUPPORTS_CLAIM" },
    { "optionId": "keycloak-26.8.0-native-self-hosted", "factPath": "compatibility.clients.BROWSER", "verdict": "SOURCE_SUPPORTS_CLAIM" },
    { "optionId": "keycloak-26.8.0-native-self-hosted", "factPath": "compatibility.membership.SINGLE_ORGANIZATION_PER_USER", "verdict": "SOURCE_SUPPORTS_CLAIM" },
    { "optionId": "keycloak-26.8.0-native-self-hosted", "factPath": "compatibility.populations.EXTERNAL_CUSTOMERS", "verdict": "SOURCE_SUPPORTS_CLAIM" },
    { "optionId": "keycloak-26.8.0-native-self-hosted", "factPath": "compatibility.tenancy.SINGLE_ORGANIZATION", "verdict": "SOURCE_SUPPORTS_CLAIM" },
    { "optionId": "keycloak-26.8.0-native-self-hosted", "factPath": "facts.GROUP_SYNC", "verdict": "SOURCE_SUPPORTS_CLAIM" },
    { "optionId": "keycloak-26.8.0-native-self-hosted", "factPath": "facts.OIDC", "verdict": "SOURCE_SUPPORTS_CLAIM" },
    { "optionId": "keycloak-26.8.0-native-self-hosted", "factPath": "facts.SAML", "verdict": "SOURCE_SUPPORTS_CLAIM" },
    { "optionId": "keycloak-26.8.0-native-self-hosted", "factPath": "facts.SCIM", "verdict": "SOURCE_SUPPORTS_CLAIM" },
    { "optionId": "workos-authkit-staging-browser-authentication-controls", "factPath": "authenticationControls.BROWSER.EXTERNAL_CUSTOMERS.NON_EXPORTABLE_KEYS", "verdict": "SOURCE_SUPPORTS_CLAIM" },
    { "optionId": "workos-authkit-staging-browser-authentication-controls", "factPath": "authenticationControls.BROWSER.EXTERNAL_CUSTOMERS.PHISHING_RESISTANCE", "verdict": "SOURCE_SUPPORTS_CLAIM" },
    { "optionId": "workos-authkit-staging-browser-authentication-controls", "factPath": "authenticationControls.BROWSER.EXTERNAL_CUSTOMERS.STEP_UP_AUTHENTICATION", "verdict": "SOURCE_SUPPORTS_CLAIM" },
    { "optionId": "workos-authkit-staging-browser-authentication-controls", "factPath": "facts.MFA", "verdict": "SOURCE_SUPPORTS_CLAIM" },
    { "optionId": "workos-authkit-staging-browser-authentication-controls", "factPath": "residency.AUDIT_LOGS", "verdict": "SOURCE_SUPPORTS_CLAIM" },
    { "optionId": "workos-authkit-staging-browser-authentication-controls", "factPath": "residency.BACKUPS", "verdict": "SOURCE_SUPPORTS_CLAIM" },
    { "optionId": "workos-authkit-staging-browser-authentication-controls", "factPath": "residency.CREDENTIALS", "verdict": "SOURCE_SUPPORTS_CLAIM" },
    { "optionId": "workos-authkit-staging-browser-authentication-controls", "factPath": "residency.USER_PROFILES", "verdict": "SOURCE_SUPPORTS_CLAIM" },
    { "optionId": "workos-connect-staging-public-oidc-clients", "factPath": "compatibility.clients.BROWSER", "verdict": "SOURCE_SUPPORTS_CLAIM" },
    { "optionId": "workos-connect-staging-public-oidc-clients", "factPath": "compatibility.clients.NATIVE_MOBILE", "verdict": "SOURCE_SUPPORTS_CLAIM" },
    { "optionId": "workos-connect-staging-public-oidc-clients", "factPath": "facts.OIDC", "verdict": "SOURCE_SUPPORTS_CLAIM" },
    { "optionId": "workos-connect-staging-public-oidc-clients", "factPath": "residency.AUDIT_LOGS", "verdict": "SOURCE_SUPPORTS_CLAIM" },
    { "optionId": "workos-connect-staging-public-oidc-clients", "factPath": "residency.BACKUPS", "verdict": "SOURCE_SUPPORTS_CLAIM" },
    { "optionId": "workos-connect-staging-public-oidc-clients", "factPath": "residency.CREDENTIALS", "verdict": "SOURCE_SUPPORTS_CLAIM" },
    { "optionId": "workos-connect-staging-public-oidc-clients", "factPath": "residency.USER_PROFILES", "verdict": "SOURCE_SUPPORTS_CLAIM" },
    { "optionId": "workos-directory-sync-staging-scim-events", "factPath": "facts.GROUP_SYNC", "verdict": "SOURCE_SUPPORTS_CLAIM" },
    { "optionId": "workos-directory-sync-staging-scim-events", "factPath": "facts.SCIM", "verdict": "SOURCE_SUPPORTS_CLAIM" },
    { "optionId": "workos-directory-sync-staging-scim-events", "factPath": "residency.AUDIT_LOGS", "verdict": "SOURCE_SUPPORTS_CLAIM" },
    { "optionId": "workos-directory-sync-staging-scim-events", "factPath": "residency.BACKUPS", "verdict": "SOURCE_SUPPORTS_CLAIM" },
    { "optionId": "workos-directory-sync-staging-scim-events", "factPath": "residency.CREDENTIALS", "verdict": "SOURCE_SUPPORTS_CLAIM" },
    { "optionId": "workos-directory-sync-staging-scim-events", "factPath": "residency.USER_PROFILES", "verdict": "SOURCE_SUPPORTS_CLAIM" },
    { "optionId": "zitadel-cloud-free-native", "factPath": "facts.GROUP_SYNC", "verdict": "SOURCE_SUPPORTS_CLAIM" },
    { "optionId": "zitadel-cloud-free-native", "factPath": "facts.OIDC", "verdict": "SOURCE_SUPPORTS_CLAIM" },
    { "optionId": "zitadel-cloud-free-native", "factPath": "facts.SAML", "verdict": "SOURCE_SUPPORTS_CLAIM" },
    { "optionId": "zitadel-cloud-free-native", "factPath": "facts.SCIM", "verdict": "SOURCE_SUPPORTS_CLAIM" }
  ]
}
